id,prize,description,amount,team
1,Winner,The tournament winning team.,£35,
2,Runner-up,The losing finalists.,£20,
3,First penalty save,Excluding penalty shoot-outs.,£10,
4,First penalty shoot-out win,The prize will be split between winner and runner-up if there are no penalty shoot-outs.,£10,
5,First team eliminated,Fewest goals scored will decide in the event of more than one team being eliminated at the same time.,£10,
6,Most cards (red + yellow),Most yellow cards will decide in the event of more than one team finishing with an equal number of cards.,£10,
7,Most goals conceded,In the tournament and excluding penalty shoot-outs.,£10,
8,Most goals scored,In the tournament and excluding penalty shoot-outs.,£10,